{
  "chapter_id": "ch-05",
  "source": "chapters/05-schramm-principle.qmd",
  "central_question": "曲線がランダムなら、駆動関数の法則は何か。",
  "reader_starting_state": "前章までの定義と主要な式を理解し、章末の未解決問題を共有している。",
  "mathematical_prerequisites": [],
  "pedagogical_prerequisites": [
    "ch-04"
  ],
  "previous_connection": "前章の出口質問「曲線がランダムなら、駆動関数の法則は何か。」をこの章の中心問題として引き継ぐ。",
  "failed_approach": "曲線がランダムなら、駆動関数の法則は何か。に対し、対象を区別せず結論だけを仮定すると、必要な仮定と証明statusを追跡できない。",
  "new_concepts": [
    {
      "id": "schramm-principle-core",
      "need": "中心問題を既知の対象だけでは閉じられないため、schramm-principleの中心構成を導入する。",
      "introduced_after": "既存の直接法が不足する理由を本文で確認した後"
    },
    {
      "id": "schramm-principle-status",
      "need": "定理・仮定・black box・数値証拠を分け、下流で利用できる結論を固定する。",
      "introduced_after": "中心構成の入力と出力を区別した後"
    }
  ],
  "derivations": [
    {
      "id": "derive-schramm-principle",
      "inputs": [
        "前章までに定義した対象",
        "当章で明示した仮定"
      ],
      "assumptions": [
        "式を適用する停止時刻または定義域の内部"
      ],
      "steps_promised": 3,
      "sanity_check": "特殊例・scale・境界値の少なくとも一つで係数と符号を検算する"
    }
  ],
  "results": [
    {
      "id": "schramm-principle-main",
      "status": "theorem",
      "theorem_id": "thm-schramm-principle"
    },
    {
      "id": "schramm-principle-boundary",
      "status": "assumption",
      "theorem_id": null
    }
  ],
  "proof_depth": "A",
  "black_boxes": [],
  "reader_stop_points": [
    {
      "question": "なぜこの概念を今導入するのか。",
      "resolution": "body",
      "location": "章の導入と最初の節"
    },
    {
      "question": "この式変形はどの仮定の下で許されるか。",
      "resolution": "body",
      "location": "中心計算"
    },
    {
      "question": "この章で証明していない範囲は何か。",
      "resolution": "body",
      "location": "章末のLimitations"
    }
  ],
  "required_bridges": [
    "前章の問い「曲線がランダムなら、駆動関数の法則は何か。」から中心構成への橋",
    "中心結果から次章の問い「Brown運動を駆動関数に入れると、本当に曲線が出るか。」への橋"
  ],
  "figures": [],
  "sources": [
    "schramm2000",
    "schramm2006"
  ],
  "next_question": "Brown運動を駆動関数に入れると、本当に曲線が出るか。",
  "quality_budget": {
    "motivations": 2,
    "worked_derivations": 1,
    "interpretations": 2,
    "explicit_limits": 1
  }
}

