{
  "chapter_id": "ch-02",
  "source": "chapters/02-curve-space.qmd",
  "central_question": "格子幅を0へ送るとき、曲線の何が収束するのか。",
  "reader_starting_state": "前章までの定義と主要な式を理解し、章末の未解決問題を共有している。",
  "mathematical_prerequisites": [],
  "pedagogical_prerequisites": [
    "ch-01"
  ],
  "previous_connection": "前章の出口質問「格子幅を0へ送るとき、曲線の何が収束するのか。」をこの章の中心問題として引き継ぐ。",
  "failed_approach": "格子幅を0へ送るとき、曲線の何が収束するのか。に対し、対象を区別せず結論だけを仮定すると、必要な仮定と証明statusを追跡できない。",
  "new_concepts": [
    {
      "id": "curve-space-core",
      "need": "中心問題を既知の対象だけでは閉じられないため、curve-spaceの中心構成を導入する。",
      "introduced_after": "既存の直接法が不足する理由を本文で確認した後"
    },
    {
      "id": "curve-space-status",
      "need": "定理・仮定・black box・数値証拠を分け、下流で利用できる結論を固定する。",
      "introduced_after": "中心構成の入力と出力を区別した後"
    }
  ],
  "derivations": [
    {
      "id": "derive-curve-space",
      "inputs": [
        "前章までに定義した対象",
        "当章で明示した仮定"
      ],
      "assumptions": [
        "式を適用する停止時刻または定義域の内部"
      ],
      "steps_promised": 3,
      "sanity_check": "特殊例・scale・境界値の少なくとも一つで係数と符号を検算する"
    }
  ],
  "results": [
    {
      "id": "curve-space-main",
      "status": "proposition",
      "theorem_id": null
    },
    {
      "id": "curve-space-boundary",
      "status": "assumption",
      "theorem_id": null
    }
  ],
  "proof_depth": "B",
  "black_boxes": [],
  "reader_stop_points": [
    {
      "question": "なぜこの概念を今導入するのか。",
      "resolution": "body",
      "location": "章の導入と最初の節"
    },
    {
      "question": "この式変形はどの仮定の下で許されるか。",
      "resolution": "body",
      "location": "中心計算"
    },
    {
      "question": "この章で証明していない範囲は何か。",
      "resolution": "body",
      "location": "章末のLimitations"
    }
  ],
  "required_bridges": [
    "前章の問い「格子幅を0へ送るとき、曲線の何が収束するのか。」から中心構成への橋",
    "中心結果から次章の問い「巨大な曲線空間を、履歴を失わずに圧縮できるか。」への橋"
  ],
  "figures": [],
  "sources": [
    "lawler2005"
  ],
  "next_question": "巨大な曲線空間を、履歴を失わずに圧縮できるか。",
  "quality_budget": {
    "motivations": 2,
    "worked_derivations": 1,
    "interpretations": 2,
    "explicit_limits": 1
  }
}

